{
  "schema": 1,
  "revision": 2,
  "updatedAt": "2026-09-24T10:00:00Z",
  "updatedBy": "example-device",
  "settings": {
    "storage": { "folder": "recly/{{yyyy}}/{{yyyy}}-{{MM}}", "minDurationSec": 30, "provider": "icloud" },
    "transcription": {
      "mode": "external", "language": "ko-en",
      "external": { "provider": "assemblyai", "secretRef": "assemblyai_key" },
      "providerDetails": {
        "clova": { "invokeUrl": "https://clovaspeech-gw.ncloud.com/external/v1/1234/0123456789abcdef" },
        "openai": { "model": "whisper-1" }
      }
    }
  }
}
